{
  "locale": "en-US",
  "client_id": "4dd69e99-07e7-c040-a514-ccde0cfd4881",
  "version": "72.0a1",
  "release_channel": "nightly",
  "addon_version": "20191119043902",
  "user_prefs": 255,
  "session_id": "{3e3fce7a-d015-7d44-9404-3547a600a9ec}",
  "page": "about:home",
  "profile_creation_date": 16587,
  "session_duration": 7000,
  "perf": {
    "load_trigger_type": "first_window_opened",
    "is_preloaded": false,
    "load_trigger_ts": 1578946833472,
    "visibility_event_rcvd_ts": 1578946834265,
    "topsites_icon_stats": {
      "custom_screenshot": 0,
      "screenshot_with_icon": 0,
      "screenshot": 0,
      "tippytop": 6,
      "rich_icon": 0,
      "no_image": 0
    },
    "topsites_pinned": 0,
    "topsites_search_shortcuts": 1,
    "topsites_data_late_by_ms": 197,
    "highlights_data_late_by_ms": 241,
    "topsites_first_painted_ts": 1578946834726
  },
  "experiments": {
    "exp_id_foo": {
      "branch": "control"
    },
    "exp_id_bar": {
      "branch": "treatment"
    }
  }
}
